{
  "schema_version": "v1",
  "timestamp": "2026-02-21T18:51:17Z",
  "result": "FAIL",
  "gate_policy_hash": "sha256:0213631133afa80b1a5efb3684c51603786555d3d93164437b274033ccf515a8",
  "gate_decision_hash": "sha256:19764d0e0d9d1b23cb17d21eb97d2a920b5425994ce165a2ddaafac51951a10a",
  "reasons": [
    {
      "code": "HASH_MISMATCH",
      "message": "Computed content_hash does not match declared hash",
      "severity": "ERROR",
      "uri": "transfer_report.json",
      "path": "$.artifacts[1]",
      "context": {
        "declared_hash": "sha256:97654b48c9c941f74d35ee2db7e0eb8833041d47fdaebdbe2e4e4b311f4c2c03",
        "computed_hash": "sha256:7c6973f2bb9c613ab3e98ff3f3c114ebcb6bc3e143b2ee5ea7e159ff3993c534",
        "possible_causes": [
          "File modified after artifact_index generation",
          "Bit corruption during transfer"
        ]
      }
    },
    {
      "code": "MISSING_REQUIRED_ARTIFACT",
      "message": "Required artifact 'transfer_report' not found in artifact_index",
      "severity": "ERROR",
      "path": "$.artifacts",
      "context": {
        "artifact_type": "transfer_report",
        "mode": "promote",
        "explanation": "Policy requires 'transfer_report' for promote mode"
      }
    }
  ],
  "artifact_refs": [
    {
      "artifact_type": "identity",
      "uri": "identity.json",
      "content_hash": "sha256:e4671fb8e7c88554c87a5e083e9d472d5d9c12ee1f4162fe71248873e69b0c56"
    }
  ]
}