{
  "schema_version": "v1",
  "timestamp": "2026-02-21T18:51:07Z",
  "result": "FAIL",
  "gate_policy_hash": "sha256:0213631133afa80b1a5efb3684c51603786555d3d93164437b274033ccf515a8",
  "gate_decision_hash": "sha256:a99bb12287169838b90d8f2ca471e0e1c6ee877cf4fc2956c4d4ec211dbc7ad1",
  "reasons": [
    {
      "code": "HASH_MISMATCH",
      "message": "Computed content_hash does not match declared hash",
      "severity": "ERROR",
      "uri": "transfer_report.json",
      "path": "$.artifacts[1]",
      "context": {
        "declared_hash": "sha256:0b2c46137b7bfcdb9a6505afc643974bb4c098a90b5d72ba4ad30564f0a3b9ef",
        "computed_hash": "sha256:31a8c91df694eff2963b2674e9f56ef819b753e576312f86883bd38302233271",
        "possible_causes": [
          "File modified after artifact_index generation",
          "Bit corruption during transfer"
        ]
      }
    },
    {
      "code": "MISSING_REQUIRED_ARTIFACT",
      "message": "Required artifact 'transfer_report' not found in artifact_index",
      "severity": "ERROR",
      "path": "$.artifacts",
      "context": {
        "artifact_type": "transfer_report",
        "mode": "promote",
        "explanation": "Policy requires 'transfer_report' for promote mode"
      }
    },
    {
      "code": "INCOMPARABLE",
      "message": "Lock 'fidelity_id' mismatch between Lane A and Lane B",
      "severity": "ERROR",
      "path": "$.transfer_report",
      "context": {
        "lock": "fidelity_id",
        "lane_a_value": "high",
        "lane_b_value": "low",
        "explanation": "Cannot compare transfer metrics across different fidelity_id values"
      }
    }
  ],
  "artifact_refs": [
    {
      "artifact_type": "identity",
      "uri": "identity.json",
      "content_hash": "sha256:e4671fb8e7c88554c87a5e083e9d472d5d9c12ee1f4162fe71248873e69b0c56"
    }
  ]
}