{
  "schema_version": "v1",
  "timestamp": "2026-02-21T18:51:02Z",
  "result": "FAIL",
  "gate_policy_hash": "sha256:0213631133afa80b1a5efb3684c51603786555d3d93164437b274033ccf515a8",
  "gate_decision_hash": "sha256:697a1ba6483c960e2b613ac67b743f74cd6d477515fd6d8853ea54999d06fdb7",
  "reasons": [
    {
      "code": "HASH_MISMATCH",
      "message": "Computed content_hash does not match declared hash",
      "severity": "ERROR",
      "uri": "transfer_report.json",
      "path": "$.artifacts[1]",
      "context": {
        "declared_hash": "sha256:0000000000000000000000000000000000000000000000000000000000000000",
        "computed_hash": "sha256:46264b37bd76b5a0485a0dbb4cdd96898d35c911817eec078113b79e56addbf8",
        "possible_causes": [
          "File modified after artifact_index generation",
          "Bit corruption during transfer"
        ]
      }
    }
  ],
  "artifact_refs": [
    {
      "artifact_type": "identity",
      "uri": "identity.json",
      "content_hash": "sha256:e4671fb8e7c88554c87a5e083e9d472d5d9c12ee1f4162fe71248873e69b0c56"
    }
  ]
}