{
  "schema_version": "v1",
  "timestamp": "2026-02-21T18:50:56Z",
  "result": "FAIL",
  "gate_policy_hash": "sha256:0213631133afa80b1a5efb3684c51603786555d3d93164437b274033ccf515a8",
  "gate_decision_hash": "sha256:044c20d6629f374cd933d6f216adbbd6b1e70fb1629f055b4d13c77aa058ce4d",
  "reasons": [
    {
      "code": "SCHEMA_VIOLATION",
      "message": "Additional properties are not allowed ('unknown_root_field' was unexpected)",
      "severity": "ERROR",
      "file": "identity.json",
      "path": "$",
      "schema_path": "#/additionalProperties",
      "context": {
        "unknown_property": "unknown_root_field"
      }
    },
    {
      "code": "SCHEMA_VIOLATION",
      "message": "Additional properties are not allowed ('unknown_nested_field' was unexpected)",
      "severity": "ERROR",
      "file": "identity.json",
      "path": "$.backtest_identity",
      "schema_path": "#/properties/backtest_identity/additionalProperties",
      "context": {
        "unknown_property": "unknown_nested_field"
      }
    }
  ],
  "artifact_refs": [
    {
      "artifact_type": "identity",
      "uri": "identity.json",
      "content_hash": "sha256:4f6f87c007dddfa5bf848ab87e447b90619899e2e6a6f96a5997bb17322469ec"
    }
  ]
}